{
  "SchemaVersion": "amd-three-tool-common-core-contract/1.0",
  "ReviewedAtUtc": "2026-08-22T13:00:00Z",
  "Normalization": "FunctionDefinitionAst.Extent.Text with CRLF/CR normalized to LF; UTF-8 SHA-256",
  "Scope": "Current Chipset, Graphics, and NPU single-file research scripts",
  "Tools": [
    {
      "Tool": "Chipset",
      "RelativePath": "tools/amd-chipset-driver-research/Invoke-AmdChipsetDriverResearch.ps1",
      "ScriptSha256": "45ad6d046547115c82db1cc7421ea059e95245c41a55d88c3d27fd5a1937c5b7",
      "FunctionCount": 315
    },
    {
      "Tool": "Graphics",
      "RelativePath": "tools/amd-graphics-driver-research/Invoke-AmdGraphicsDriverResearch.ps1",
      "ScriptSha256": "262eee0e0b3b11525b8368367230e64c6f5cac7e4dd35e881f7f716d2bc1147f",
      "FunctionCount": 303
    },
    {
      "Tool": "NPU",
      "RelativePath": "tools/amd-npu-driver-research/Invoke-AmdNpuDriverResearch.ps1",
      "ScriptSha256": "dba9761d9dc69463e34207dd3fa039b1a0de712a47ebe8698da66435736d0dd1",
      "FunctionCount": 326
    }
  ],
  "FunctionCount": 166,
  "Functions": [
    {
      "Name": "Add-AmdCertificateEvidence",
      "Sha256": "feeae2390a6d369204b048327d1cfa41bed7e46eeb8b02a1074655ca80967732"
    },
    {
      "Name": "Add-AmdHashSegment",
      "Sha256": "b94c1d2bb377fa9f239950e37dec447cb0e3547f56a500b3415b7fcfbdb59aa2"
    },
    {
      "Name": "Assert-AmdExtractionCompleteSet",
      "Sha256": "1cdc3901efb4f7afdf3b6da9d61f5e53ec4d203a1e83d0df841ea1f7421de1f5"
    },
    {
      "Name": "ConvertFrom-AmdDerOid",
      "Sha256": "91ca59abd890b3ad1c1a8e870bca8ca42de9549a159e57c51bfaf015fa9012a1"
    },
    {
      "Name": "ConvertFrom-AmdSevenZipSltPathEntries",
      "Sha256": "0d15a5c3101bc62c487aaae786625d5780553bb04039bb92e981f8c9bf049104"
    },
    {
      "Name": "ConvertFrom-AmdXmlText",
      "Sha256": "13e4aeb6a93f1b94dd4c52b29f1b6c6b32245edf1b73777bb367af1f9cd334c6"
    },
    {
      "Name": "ConvertFrom-CanonicalJson",
      "Sha256": "26316052cb5c4866692df18db52afdf1dfaaf65b9b2b4c75bc30a6b8b4a7aee1"
    },
    {
      "Name": "ConvertTo-AmdCatalogAttributeEvidence",
      "Sha256": "7b7c260142e0cfbc84a0448586f4de42e50bed76b85f86d2bc427cbb4d315cef"
    },
    {
      "Name": "ConvertTo-AmdCryptographicAttributeEvidence",
      "Sha256": "94b29944d613aba45a0e9bbe75a98559ba25e794829cbcd2dd0a49f1733d3cda"
    },
    {
      "Name": "ConvertTo-AmdEvidenceSafeFragment",
      "Sha256": "6282e5602ad98b71a43e4cb20bddca2f23979f72eb41a80b927c043922254f9a"
    },
    {
      "Name": "ConvertTo-AmdHexString",
      "Sha256": "d4eac1a1330ef0274bd5a7332b5edf5112ee088c233a7a4d4b21b67485e6161b"
    },
    {
      "Name": "ConvertTo-AmdRedactedHeaderMap",
      "Sha256": "9816db1d1c83c0d00078d32480aafd2eb58bc0d7a0729015dcfcd0e8ab1687b9"
    },
    {
      "Name": "ConvertTo-AmdSafeName",
      "Sha256": "88c566d41e4881d1e20759eaad941eb2df614700b138a3c536cefe7c27f93742"
    },
    {
      "Name": "ConvertTo-CanonicalJson",
      "Sha256": "638b4030616c4aaf7b54bd4133041f3c177d4171d449f54fb0f5a2f604968529"
    },
    {
      "Name": "Copy-AmdEvidenceTree",
      "Sha256": "80cdc634cd9092551b514c843a39b45d20360e78efaba25e66137e376b7a3e31"
    },
    {
      "Name": "Enable-AmdTls12ForWindowsPowerShell",
      "Sha256": "ff434bc93a9028e66dc34941be43c2a131d15bc22f68138844d61cbfa212df90"
    },
    {
      "Name": "Format-AmdByteSize",
      "Sha256": "600dd230e5802b9f381e64ecfe81616efe215075215f9b7ef85018a0e1c09b8f"
    },
    {
      "Name": "Format-AmdElapsed",
      "Sha256": "988c87ffd9dff46be75b0422d041042c814807775ab80ede5d61a00febf98c2f"
    },
    {
      "Name": "Get-AmdArchiveExtractionPathAssessment",
      "Sha256": "20929c34290bdb771fb17a7724d3ba0559eb220c8e4de735cb90eb27e0fb9297"
    },
    {
      "Name": "Get-AmdAuthenticodePeDigest",
      "Sha256": "a4a96ce4ef91a2b46432969d6d0ffc4e8c9a9940b096d09b93cc0dabeddcc512"
    },
    {
      "Name": "Get-AmdBoundedTextPreview",
      "Sha256": "4890363cd5d79756bdb4e5b777277169f5be502064294a3027eae961b10d1789"
    },
    {
      "Name": "Get-AmdCatalogBoundSignToolEvidence",
      "Sha256": "a4a0de56ed2d7ff883f43d9b071ec97068ddaf9a46b712e173309a466c9d2bb0"
    },
    {
      "Name": "Get-AmdCatalogBoundSignToolProfileDefinitions",
      "Sha256": "9f2ed9afc95dfb88fc3869508c67a48b98c5cc97bbe4488162664b93c90a2773"
    },
    {
      "Name": "Get-AmdCertificateEvidence",
      "Sha256": "112f3b426437dd5d1e4dcef093e7a9c3d4a19fc86ad9cbec40aad6abcc30cdf6"
    },
    {
      "Name": "Get-AmdCollectionItems",
      "Sha256": "8c7f3bdba7c49716c87f03ce8cedaf0c6c3abd322f584fb4fc5da8d8f5540f43"
    },
    {
      "Name": "Get-AmdCommandPath",
      "Sha256": "841115adf2112b0b3edb19c7401d3e32f1e02ee675f845e7b867e5be0db4f4e2"
    },
    {
      "Name": "Get-AmdCompactErrorMessage",
      "Sha256": "451ebcbdc74223387b717efb4e0efae630ff11a31d4f5a981a025e93f888a96b"
    },
    {
      "Name": "Get-AmdCultureNameFromLcid",
      "Sha256": "7f1f795881d16a8e1a0c07e281f2c35a86631b0572fd8327907b68431706a902"
    },
    {
      "Name": "Get-AmdDownloadedPayloadDecision",
      "Sha256": "1cc4193492a5e6945b47c3897b467dcd91342df2821735394ccf004d6cad17a7"
    },
    {
      "Name": "Get-AmdEvidenceSafeLabel",
      "Sha256": "33c959f44b821ce2b3f3a8bb89d451ae48b4e0789ecc61b1993acd70cfbae9d1"
    },
    {
      "Name": "Get-AmdEvidenceStoragePolicy",
      "Sha256": "f6a07aed737f22fb853c79ff10b56554e7b8dc4ef32ee9de524f17dbe5ab8557"
    },
    {
      "Name": "Get-AmdExceptionDiagnostic",
      "Sha256": "4822b80afe4defe074abfc01b069db21f0b71088e689ec547f1a921d102dcf88"
    },
    {
      "Name": "Get-AmdHttpDownloadResponseDecision",
      "Sha256": "7e18ec2e0c3f3f402068d067697de6f5bd36eb46b8a0ede0b4567cab6f1e2e03"
    },
    {
      "Name": "Get-AmdHttpRetryDecision",
      "Sha256": "c2407965274d78be29e86f2e91b124f427d87cdc1228fdf5a5befd1ee04baef0"
    },
    {
      "Name": "Get-AmdInfDirectiveValue",
      "Sha256": "e286a4d06628812b799b1f56ba5f70ea329942d22a103c97fdec750fbd83c0a8"
    },
    {
      "Name": "Get-AmdInfHardwareIds",
      "Sha256": "cabf71037999a01d243ff2d70d65e8344d64b91a03967129394b86c6cdd98d49"
    },
    {
      "Name": "Get-AmdInfVersionSectionValue",
      "Sha256": "d823f9ba80f8d30525fce5372721b1593f88d5f449a523ce8c92324a8bb8b9bb"
    },
    {
      "Name": "Get-AmdInstallerFileValidation",
      "Sha256": "a8cfdbd9494929ae8159e3a8245854f2573d428b691e24fb5d55e607d921e510"
    },
    {
      "Name": "Get-AmdKernelSignatureCoverageAssessment",
      "Sha256": "dc61d4e8ec579d4164cf95a339ad22a3e137f48fee142f0c17e8d8dff811655f"
    },
    {
      "Name": "Get-AmdLinuxPackageEvidence",
      "Sha256": "3b5d11fea0bb1024badd4f48b0a8c09d9f663fe9b816bf7cb347bae630b85aa7"
    },
    {
      "Name": "Get-AmdLocaleNeutralNativeResultClass",
      "Sha256": "14c3b9b7a5e93539a2c7519e2526f7ea83569e1864891f48482a742fd398d152"
    },
    {
      "Name": "Get-AmdNativeToolLocalizationContext",
      "Sha256": "3dcd59d36447ea2ddeb7609ec20eef17549d94b2cfdb9e337f2d4f7070a567a5"
    },
    {
      "Name": "Get-AmdOptionObservationsFromText",
      "Sha256": "3fe5a590ad4d8c07b9324f6ae5020bfb863b683eb18b573ac3115b49d09bae43"
    },
    {
      "Name": "Get-AmdOrdinalSortedObjectsByStringProperty",
      "Sha256": "0da5c5ab841a99135097ff5d34d908b2c5187e6808d7725173f5cd212a543327"
    },
    {
      "Name": "Get-AmdOrdinalSortedUniqueStrings",
      "Sha256": "93cbee68ebb67fc2a6d994e92b2091be7fdb883ceaf70192b1bc5e6c66d09fb7"
    },
    {
      "Name": "Get-AmdPathReparsePoints",
      "Sha256": "248aff37c469622fd61d08f7b4c92a283e6aef9c3a11f2b04532ee010a75dd53"
    },
    {
      "Name": "Get-AmdPathSafetyAssessment",
      "Sha256": "c90da8e2a839a9bb2bb26844189d55ad7d59ae4c6f3a08f6524a92ca9b0ba191"
    },
    {
      "Name": "Get-AmdPeCertificateEntries",
      "Sha256": "d71d19d13309a7cf9d869128a85f5dbdf1785f15e32a8a79c14386188757f042"
    },
    {
      "Name": "Get-AmdPeMachineArchitecture",
      "Sha256": "d4820b87a7b01ecd586a63dde511c617ed55a71c9718b0738c391ea731311f18"
    },
    {
      "Name": "Get-AmdPlatformInfo",
      "Sha256": "8ab02992f463786821747df1133c4b392deac44e31c2b4d80d5311eb35f6b211"
    },
    {
      "Name": "Get-AmdPortableWindowsKitPathIdentity",
      "Sha256": "24aa0a7a5fc315241994b99587d6e8264c3623db5f7cef49242d123ce33c5210"
    },
    {
      "Name": "Get-AmdPublicForbiddenPatterns",
      "Sha256": "7de6fb75efc909d62289a430aa8f6c7313d779eaa93c0e29bdb2aef74310c1c5"
    },
    {
      "Name": "Get-AmdPublicScalarStrings",
      "Sha256": "20e8ea3c5c771f43d9dcfceeea8e7bacf3e5b644526324d3492c7325729c3b97"
    },
    {
      "Name": "Get-AmdRelativePath",
      "Sha256": "6ec34e4f6678c98e5c827723eb9e7025c7fb9a1ff3ec455a6adecfe332a8c023"
    },
    {
      "Name": "Get-AmdRetryAfterMilliseconds",
      "Sha256": "a02228dd9259ac3dcbc5b4e474a8d96ba0e5064c70bf619b3dd88aa85d804731"
    },
    {
      "Name": "Get-AmdRetryDelayMilliseconds",
      "Sha256": "7cb5d71a3c86cd976a23fc4fe29366b4202ce1ffc21fb9c91774126a4266a7cd"
    },
    {
      "Name": "Get-AmdSevenZipInfo",
      "Sha256": "ae96819802515d70e639c5c3f77c38e5377de59cc7cd0eb717cd556dcc2dbe54"
    },
    {
      "Name": "Get-AmdSevenZipPath",
      "Sha256": "47e3b31a74a1967aae77de6eb50215b07c7c6c9fc497ec580a815a67ee40c051"
    },
    {
      "Name": "Get-AmdSha256",
      "Sha256": "175f8ac5be703ea5253c282d29cfc9cf6cff5d5d53fca621e16f31d94643defc"
    },
    {
      "Name": "Get-AmdShortExtractionPath",
      "Sha256": "97441391be0d1ab8556f1f9fd4bf500321b8c6d72d2e554e9be293b1a7e893aa"
    },
    {
      "Name": "Get-AmdSignToolResultClass",
      "Sha256": "99115f64fc06d2b525077a1b885045425e5235f61d204ff58c5a395bde469d18"
    },
    {
      "Name": "Get-AmdSignToolVerificationEvidence",
      "Sha256": "bdad9f6feea4974547217fb27f8f3200b95c3d03bf7bc886c22ca4875303848f"
    },
    {
      "Name": "Get-AmdSignatureArtifactKind",